Rank,Movie,Worldwide Box Office,Domestic Box Office,International Box Office,"Domestic
Share",Date,Production Budget,Running Time,Keywords,Genre,Production Countries,Languages,Opening_theaters,Max_theaters,Average_run(week)
71,A Simple Favor,97628717.0,53548586,44080131,0.5485,"September 14th, 2018",20000000,116,"Non-Chronological, Prologue, Internet, Life in a Small Town, Missing Person, Same Actor, Multiple Roles, Money Troubles, Twins, Murder Mystery, Death of a Twin, Addiction, Infidelity, Surprise Twist, Child Abuse, Young Child Dealing with the Death of a Parent, Familicide, Death of a Sibling, Voiceover/Narration, Insurance Fraud, Writing and Writers, Widow/Widower, Death of a Spouse or Fiancée / Fiancé, Film Noir, Step-Family, Dysfunctional Family, Epilogue, Intertitle, Psychological Thriller",Thriller/Suspense,United States,English,"3,102",3102,4.6
72,Sherlock Gnomes,97459106.0,43242871,54216235,0.4437,"March 23rd, 2018",59000000,86,"Private Investigator, Romance, Animated Inanimate Objects, Delayed Sequel, Missing Person, 3-D, 3-D - Shot in 3-D",Adventure,United States,English,"3,662",3662,4.6
73,Xiong Chu Mei Zhi Bian Xing Ji,96784216.0,0,96784216,,,0,90,,Adventure,China,Mandarin,nan,0,
74,The Favourite,95849029.0,34366783,61482246,0.3586,"November 23rd, 2018",15000000,119,"1700s, Royalty, Set in England, LGBTQ+, Cross-Dressing, Romance, 2019 Oscars Best Picture Nominee, Black Comedy",Black Comedy,"Ireland, United Kingdom, United States",English,4,1554,6.2
75,Truth or Dare,95292744.0,41411015,53881729,0.4346,"April 13th, 2018",3500000,100,"Supernatural, Slasher Horror, Dares",Thriller/Suspense,United States,English,"3,029",3068,4.0
76,Shou Ji Kuang Xiang,94951615.0,0,94951615,,,0,90,,Drama,China,Mandarin,nan,0,
77,Blockers,94523781.0,60311495,34212286,0.6381,"April 6th, 2018",21000000,102,"Epilogue, Prom, Loss Of Virginity, High School, Dysfunctional Family, Interracial Romance, LGBTQ+, Closeted Homosexual, Coming Out, Prologue, Same Role, Multiple Actors, Teenage Sex Comedy, Single Parent, Empty Nest, Graduation, Scene in End Credits",Comedy,United States,English,"3,379",3418,4.7
78,Singwa Hamgge: Ingwa Yeon,93453434.0,1200246,92253188,0.0128,"August 1st, 2018",0,135,"Death as a Character, Afterlife, Courtroom Drama, Dinosaurs",Action,Republic of Korea,Korean,47,47,2.9
79,BlacKkKlansman,93411426.0,49275340,44136086,0.5275,"August 10th, 2018",15000000,134,"Ku Klux Klan, Undercover, Prologue, 1970s, African Americans, Jewish, Civil Rights Movement, Set in Colorado, 2010s, White Supremacists, Hate Crime, 2019 Oscars Best Picture Nominee, Black Comedy",Black Comedy,United States,English,"1,512",1914,5.6
80,Goosebumps 2: Haunted Halloween,93006429.0,46697321,46309108,0.5021,"October 12th, 2018",35000000,90,"Supernatural, Circus, Creature Feature, Living Toys, Sequels Without Their Original Stars, Kids Horror, Halloween",Horror,"Australia, United States",English,"3,521",3723,4.5
81,Jing Zhou,91462581.0,521396,90941185,0.005699999999999999,"May 3rd, 2019",0,116,"Wuxia, War, Ancient China, Zhou Dynasty, Betrayal, Martial Arts, Underwater, Slow Motion Scene, Regicide",Action,China,Mandarin,4,53,3.5
82,I Feel Pretty,91444095.0,48795601,42648494,0.5336,"April 20th, 2018",32000000,110,"Hallucinations, Fashion, Romance, Relationships Gone Wrong, Body Swap, Farcical / Slapstick Comedy",Comedy,United States,English,"3,440",3440,4.6
83,Overboard,91244913.0,50316123,40928790,0.5514,"May 4th, 2018",12000000,112,"Remake, Faulty Memory, Romance, Boss From Hell, Cross-Class Romance, Genderbending Casting, Unexpected Families, Hispanic",Romantic Comedy,United States,English,"1,623",2006,5.0
84,Di Ren Jie Zhi Si Da Tian Wang,90035547.0,262963,89772584,0.0029,"July 27th, 2018",0,131,"Supernatural, Martial Arts, Wuxia, Private Investigator, Romance, Inbetwequel, Prequel",Action,"China, Hong Kong",Mandarin,31,31,1.8
85,Li Cha De Gu Ma,86876449.0,0,86876449,,,0,90,,Comedy,China,Mandarin,nan,0,
86,I Can Only Imagine,85783567.0,83482352,2301215,0.9732,"March 16th, 2018",7000000,110,"Inspired by a True Story, Faith-Based Film, Religious, Christians, Dysfunctional Family, Young Child Dealing with the Death of a Parent, Child Abuse, Singers, Songwriter, Same Role, Multiple Actors, Faith-Based Drama",Drama,United States,English,"1,627",2894,5.8
87,Mortal Engines,85481904.0,15951040,69530864,0.1866,"December 14th, 2018",100000000,128,"Post Apocalypse, Exile, Revenge, Young Child Dealing with the Death of a Parent, Steampunk, Set in London, 3-D, 3-D - Post-production Conversion, IMAX: DMR, Action Adventure",Action,"New Zealand, United States",English,"3,103",3103,3.2
88,Robin Hood,85210012.0,30824628,54385384,0.3617,"November 21st, 2018",99000000,116,"Robin Hood Bandits, 1300s, Set in England, Action Adventure, Romance, Relationships Gone Wrong, Love Triangle, Revenge",Action,United States,English,"2,827",2939,3.6
89,Xie Bu Ya Zheng,85170584.0,0,85170584,,,0,137,,Drama,"China, United States","English, Japanese, Mandarin",nan,0,
90,Hereditary,81263489.0,44069456,37194033,0.5423,"June 8th, 2018",10000000,126,"Adult Child Dealing with the Death of a Parent, Death of a Son or Daughter, Car Accident, Dysfunctional Family, Supernatural, Cults, Occult, Séance, Dream Sequence, Sleepwalking, Demons, Possessed, Sundance Film Festival 2018, Supernatural Horror",Horror,United States,English,"2,964",2998,3.7
91,Ai qing gong yu,81096320.0,0,81096320,,,0,115,,Romantic Comedy,China,Mandarin,nan,0,
92,Den of Thieves,80147166.0,44947622,35199544,0.5608,"January 19th, 2018",30000000,140,"Set in Los Angeles, Heist, Bank Robbery, Cops and Robbers, Corrupt Cops, Crime, Action Thriller",Action,United States,English,"2,432",2432,4.1
93,Eiga Doraemon Nobita no Takarajima,79904554.0,0,79904554,,,0,109,Anime,Adventure,Japan,Japanese,nan,0,
94,The Spy Who Dumped Me,78998245.0,33562069,45436176,0.42479999999999996,"August 3rd, 2018",40000000,117,"Set in Los Angeles, C.I.A., Relationships Gone Wrong, Hitmen, Exes in Love, Secret Agent, Fugitive / On the Run, Aspiring Actress / Actor, Set in Vienna, Set in Prague, Set in Paris, Travelogue, Tortured for Information, Double Agent, Secret Identity, Action Comedy",Comedy,United States,English,"3,111",3111,3.5
95,Code Blue the Movie,78778560.0,0,78778560,,,0,127,,Drama,Japan,Japanese,nan,0,
96,Tag,77024944.0,54730625,22294319,0.7106,"June 15th, 2018",28000000,100,"Delayed Adulthood, Ensemble, Miscellaneous Sports, Wedding Day, Wedding Day Disasters, Action Comedy",Comedy,United States,English,"3,382",3382,4.3
97,Sicario: Day of the Soldado,76346094.0,50065850,26280244,0.6557999999999999,"June 29th, 2018",35000000,123,"Set in Mexico, Drug Cartels, Human-Trafficking, Smuggler, Terrorism, Kidnap, Government Corruption, Sequels Without Their Original Stars",Action,"Italy, United States","English, Spanish","3,055",3055,3.5
98,Widows,75984700.0,42402632,33582068,0.5579999999999999,"November 16th, 2018",40000000,129,"Heist, Death of a Spouse or Fiancée / Fiancé, Organized Crime, Money Troubles, Remake, Boxing, Crime Thriller",Thriller/Suspense,"United Kingdom, United States",English,"2,803",2803,4.3
99,Searching,75636047.0,26015149,49620898,0.344,"August 24th, 2018",880000,101,"Missing Person, Missing Child, Dysfunctional Family, Internet, Unbelieving Police, Surprise Twist, Catfishing, Computer Screen Film, Crime Thriller",Thriller/Suspense,United States,English,9,2009,4.3
100,Dongwu shijie,74842075.0,0,74842075,,,0,132,,Adventure,China,Mandarin,nan,0,
101,Padmavati,74630951.0,11846060,62784891,0.15869999999999998,"January 25th, 2018",0,164,"1300s, Set in India, Set in Afghanistan, Royalty, Obsessive Love, 3-D, 3-D - Post-production Conversion, Relationships Gone Wrong, Infidelity, War, Kidnap, Romance, Assassination, Dysfunctional Family, Suicide, Romantic Drama",Drama,India,Hindi,326,354,3.4
102,Sanju,73526244.0,7909317,65616927,0.1076,"June 29th, 2018",0,161,"Biography, Film Actor, Ensemble, Addiction, Organized Crime, Life on the Outside, Set in India, Prison, Father’s Footsteps, Child Actor, Narcotics, Biographical Drama",Drama,India,Hindi,356,359,3.1
103,Astérix: Le secret de la potion magique,73216733.0,0,73216733,,,0,85,"3-D, 3-D - Shot in 3-D",Adventure,France,"French, Latin",nan,0,
104,Manbiki kazoku,72625771.0,3313513,69312258,0.045599999999999995,"November 23rd, 2018",0,121,"Poverty, Homeless, Autumn Years, Abandoned Child, Set in Japan, Child Abuse, Set in Tokyo",Drama,Japan,Japanese,5,144,7.2
105,"Li hai le, wo de guo",72506344.0,0,72506344,,,0,90,,Documentary,China,Mandarin,nan,0,
106,12 Strong,71118378.0,45819713,25298665,0.6443000000000001,"January 19th, 2018",35000000,90,"2000s, 9/11, C.I.A., Taliban, Set in Afghanistan, Afghanistan War, Special Ops, IMAX: DMR, War Drama",Drama,United States,English,"3,002",3018,4.2
107,Vice,70893782.0,47836282,23057500,0.6748000000000001,"December 25th, 2018",60000000,132,"Biography, Politicians, 2000s, 2019 Oscars Best Picture Nominee",Black Comedy,United States,English,"2,442",2534,5.3
108,Mile 22,66295121.0,36108758,30186363,0.5447,"August 17th, 2018",35000000,90,"C.I.A., Demoted, Set in Indonesia, Death of a Son or Daughter, Revenge, Crime Boss, Organized Crime, Bounty/Price on one's Head, Fugitive / On the Run, Corrupt Cops, Betrayal, IMAX: DMR, Action Thriller",Action,United States,English,"3,520",3520,3.5
109,Life of the Party,65859911.0,53059911,12800000,0.8056,"May 11th, 2018",30000000,105,"College, Adult Education, Screenplay Written By the Star, Delayed Adulthood, Dysfunctional Family, Relationships Gone Wrong, Mid-Life Crisis, Farcical / Slapstick Comedy",Comedy,United States,English,"3,656",3656,4.4
110,"Love, Simon",65520633.0,40826341,24694292,0.6231,"March 16th, 2018",10000000,107,"Romance, LGBTQ+, Closeted Homosexual, Coming of Age, Coming Out, High School, Secret Identity, Coming-of-Age Drama, Blackmail",Drama,United States,English,"2,402",2434,4.2
111,Cafarnaúm,65233793.0,1660708,63573085,0.0255,"December 14th, 2018",4000000,126,"Set in Lebanon, Dysfunctional Family, Runaway, Homeless, Courtroom Drama, Non Professional Actor",Drama,"Lebanon, United States","Amharic, Arabic",3,136,5.0
112,L Feng Bao,63931005.0,0,63931005,,,0,90,,Action,Hong Kong,Cantonese,nan,0,
113,Second Act,63288854.0,39282227,24006627,0.6207,"December 21st, 2018",15700000,104,"False Identity, Mid-Life Crisis, Comedy Drama, Unexpected Families, Promotion, Corporate Life",Comedy,United States,English,"2,607",2607,4.7
114,Isle of Dogs,58591078.0,32015231,26575847,0.5464,"March 23rd, 2018",0,105,"Set in Japan, Missing Pet, Coming of Age, Quarantine, Epidemic, Animal Lead, Talking Animals, Intertitle, Prologue, Near Future, 2030s, Voiceover/Narration, Young Child Dealing with the Death of a Parent, Orphan, Dysfunctional Family, Non-Chronological, Research Scientist, Government Corruption, Political Assassination, Split Screen, Separated at Birth, Chase Adventure",Adventure,United States,English,27,1947,4.3
115,Adrift,57897191.0,31445011,26452180,0.5431,"June 1st, 2018",35000000,80,"Romance, On a Boat, Extreme Weather, Disaster, Lost At Sea, 1980s, Survival Drama",Drama,United States,English,"3,015",3015,3.3
116,Mu Hou Wan Jia,56235548.0,0,56235548,,,0,90,,Drama,China,Mandarin,nan,0,
117,The 15:17 to Paris,56096200.0,36276286,19819914,0.6467,"February 9th, 2018",30000000,94,"Non-Chronological, 2010s, Ex-soldier, Terrorism, Trains, Nightclub, Non Professional Actor, Autobiographical, Biographical Drama",Drama,United States,English,"3,042",3042,3.8
118,La ch'tite famille,55613061.0,0,55613061,,,31400000,107,,Comedy,France,"English, French",nan,0,
119,Kuai Ba Wo Ge Dai Zou,54663066.0,0,54663066,,"August 24th, 2018",0,90,"Wish Granters, Dysfunctional Family",Comedy,China,Mandarin,nan,0,
120,Bei Shang Ni Liu Cheng He,51955230.0,0,51955230,,,0,0,,Drama,China,Mandarin,nan,0,
121,Slender Man,51945949.0,30564825,21381124,0.5884,"August 10th, 2018",10000000,93,"Supernatural, Missing Child, Mental Hospital, Mind Control, Demons, Massachusetts, Internet, Hallucinations, Supernatural Horror",Horror,United States,English,"2,358",2358,4.3
122,Peppermint,51800758.0,35418723,16382035,0.6837000000000001,"September 7th, 2018",25000000,102,"Revenge, Death of a Son or Daughter, Death of a Spouse or Fiancée / Fiancé, Government Corruption, Corrupt Cops, Corrupt Judge, Action Thriller",Action,United States,English,"2,980",2980,4.0
123,Teen Titans Go! To The Movies,51620593.0,29790236,21830357,0.5771000000000001,"July 27th, 2018",10000000,92,"2D Digitally Animated Films, D.C. Comics, Movie Business, Celebrity Worship, Cyborg, Friendly Alien on Earth, Demons, Shapeshifter, Coming of Age",Adventure,United States,English,"3,188",3188,3.2
124,Breaking In,51485382.0,46840590,4644792,0.9098,"May 11th, 2018",6000000,88,"Hostage, Home Invasion, Rescue, Single Parent, Adult Child Dealing with the Death of a Parent, Inheritance, Prologue, Action Thriller",Thriller/Suspense,United States,English,"2,537",2537,4.3
125,Andhadhun,48707583.0,1193049,47514534,0.0245,"October 5th, 2018",0,139,"Blindness, Musicians, Romance, Hostage, Car Chase",Multiple Genres,India,Hindi,56,62,4.8
126,Death Wish,48575965.0,34017028,14558937,0.7003,"March 2nd, 2018",30000000,107,"Revenge, Death of a Son or Daughter, Death of Other Extended Family, Death of a Spouse or Fiancée / Fiancé, Vigilante, Remake, Development Hell, Action Thriller",Action,United States,English,"2,847",2882,3.7
127,Mary Queen of Scots,48481754.0,16648499,31833255,0.34340000000000004,"December 7th, 2018",25000000,125,"Royalty, Dysfunctional Family, Sibling Rivalry, 1500s, Set in Scotland, Set in England, Intentionally Anachronistic, Historical Drama, Treason, Rebellion",Drama,"United Kingdom, United States",English,4,1052,3.9
128,Les Tuche 3,47427990.0,0,47427990,,,0,92,,Comedy,France,French,nan,0,
129,Acrimony,46627836.0,43549096,3078740,0.934,"March 30th, 2018",20000000,120,"Relationships Gone Wrong, Infidelity, African Americans, Revenge, Inventor, Rags to Riches, Psychological Thriller, Money Troubles",Thriller/Suspense,United States,English,"2,006",2006,3.9
130,Uncle Drew,46594261.0,42469946,4124315,0.9115000000000001,"June 29th, 2018",18000000,103,"Basketball, Road Trip, Out of Retirement, Ensemble, Gratuitous Cameos, Set in Harlem, Set in New York City, Sports Comedy",Comedy,United States,English,"2,742",2742,3.5
131,Campeones,46236356.0,0,46236356,,,0,124,,Comedy,Spain,Spanish,nan,0,
132,Huang Jin Xiong Di,46165078.0,285795,45879283,0.0062,"September 28th, 2018",0,90,"Orphanage, Orphan, Mercenaries, Heist, Car Chase, Shootout, Ensemble, Robin Hood Bandits, Medical and Hospitals, Set in Africa, Set in China, Set in Japan, Set in Hungary, Revenge",Action,Hong Kong,Cantonese,34,34,1.7
133,Winchester,45960255.0,25091816,20868439,0.5459,"February 2nd, 2018",3500000,99,"Supernatural, Family Affair, 1800s, Haunted House, Widow/Widower, Set in California, Set in San Francisco, Death of a Spouse or Fiancée / Fiancé, Death of a Son or Daughter, Inspired by a True Story, Supernatural Horror, Friendly Ghost, Suicide, Addiction, Psychics",Horror,United States,English,"2,480",2480,3.4
134,Legend of Tang Dynasty 2,45521268.0,0,45521268,,,0,89,,Adventure,China,,nan,0,
135,Early Man,45285890.0,8267544,37018346,0.1826,"February 16th, 2018",50000000,89,"Hunting, Cavemen, Soccer, Culture Clash, Cross-Culture Romance, Talking Animals, Dinosaurs, Prehistoric Times, Sword and Sandal, Prologue, Disaster, Intertitle, Mistaken Identity, Training Montage",Adventure,"France, United Kingdom",English,"2,494",2494,2.5
136,Annihilation,43070915.0,32732301,10338614,0.76,"February 23rd, 2018",55000000,115,"Unnamed Character, Environment, Scientific Expedition, Isolation Horror, Motion Capture Performance",Thriller/Suspense,"United Kingdom, United States",English,"2,012",2112,3.7
137,The Possession of Hannah Grace,42873730.0,14836174,28037556,0.34600000000000003,"November 30th, 2018",6000000,85,"Supernatural, Security Guard, Possessed, Rehab / Former Addict, Supernatural Horror",Horror,United States,English,"2,065",2298,2.6
138,Di Qiu Zui Hou De Ye Wang,42147036.0,521365,41625671,0.0124,"April 12th, 2019",0,133,"3-D, Ping Pong, Long Take, You Can't Go Home Again, Funeral Reunions, Adult Child Dealing with the Death of a Parent, 2000s, Voiceover/Narration, Romance, Unrequited Love",Drama,"China, France",Mandarin,3,24,6.6
139,Taxi 5,41957523.0,0,41957523,,,0,102,IMAX: DMR,Comedy,France,French,nan,0,
140,Holmes & Watson,41926605.0,30568743,11357862,0.7291,"December 25th, 2018",42000000,90,"1890s, Woman in a Male Dominated Profession, Private Investigator, Royalty, Assassination, Farcical / Slapstick Comedy",Comedy,United States,English,"2,776",2780,2.5
141,Ansisung,41754733.0,472166,41282567,0.0113,"September 21st, 2018",0,136,"War, Siege, Set in Korea, Tang Dynasty, Ancient China",Action,Republic of Korea,Korean,30,30,2.8
142,Zhao Dao Ni,41046927.0,0,41046927,,,0,102,,Drama,China,Mandarin,nan,0,
143,Show Dogs,40014998.0,17744685,22270313,0.4435,"May 18th, 2018",5500000,92,"Talking Animals, Animal Lead, Undercover, Buddy Cop, Set in Las Vegas, Police Procedural, Animal Trafficking, FBI, Farcical / Slapstick Comedy",Comedy,United States,English,"3,212",3212,3.4
144,T-34,39526616.0,0,39526616,,,10000000,75,,Drama,Russian Federation,Russian,nan,0,
145,wanbyeokhan tain,39504707.0,0,39504707,,,0,115,,Comedy,Republic of Korea,Korean,nan,0,
146,Overlord,39178189.0,21704844,17473345,0.5539999999999999,"November 9th, 2018",38000000,109,"World War II, Nazis, Scientific Experiment Gone Awry, Behind Enemy Lines, Occult, Super Soldiers, IMAX: DMR, Action Horror, 1940s",Action,United States,English,"2,859",2859,2.8
147,Dokjeon,39013100.0,365639,38647461,0.009399999999999999,"June 8th, 2018",0,123,"Set in South Korea, Organized Crime, Crime Boss, Drug Dealer, Corrupt Cops, Crime Thriller, Revenge",Thriller/Suspense,Republic of Korea,Korean,32,32,2.0
148,On the Basis of Sex,38794346.0,24704837,14089509,0.6368,"December 25th, 2018",20000000,118,"Biography, Lawyers, Courtroom Drama, Supreme Court, 1970s, 1950s, Intertitle, Feminism, Discrimination, Black List Graduates",Drama,United States,English,33,1957,4.0
149,Nada a Perder,38399842.0,679531,37720311,0.0177,"May 10th, 2018",0,130,"Biography, Set in Brazil, Religious, Hagiography, Autobiographical, Agitprop",Drama,Brazil,Portuguese,69,69,1.0
150,The Darkest Minds,38361428.0,12695691,25665737,0.3309,"August 3rd, 2018",34000000,105,"Runaway, Betrayal, Resistance Fighter, Near Future, Psychics, Fugitive / On the Run, Bounty Hunter, Suicide, Sex Crimes, Faulty Memory, Action Adventure",Adventure,United States,English,"3,127",3127,2.3
151,Gongjak,38191961.0,497755,37694206,0.013000000000000001,"August 10th, 2018",0,141,"Set in South Korea, Set in North Korea, Secret Agent, 1990s, Weapons of Mass Destruction, Set in Beijing, Set in China, Political",Drama,Republic of Korea,"Japanese, Korean, Mandarin",2,31,2.6
152,Pan Zi Xinh Dong Dui,37516290.0,0,37516290,,,0,90,,Comedy,China,Mandarin,nan,0,
153,Nan Ji Jue Lian,37018444.0,118352,36900092,0.0032,"February 2nd, 2018",0,90,"In a Plane, Disaster, Marooned, Extreme Weather, Romance, Cross-Class Romance, Limited Dialogue",Adventure,China,Mandarin,27,27,1.5
154,Le Grand Bain,36917567.0,0,36917567,,,0,122,,Comedy,France,French,nan,0,
155,The Hate U Give,35067665.0,29719483,5348182,0.8475,"October 5th, 2018",23000000,133,"Police Shooting, Prep School, Race Relations, Death of a Best Friend, Narcotics, Political Activist, Political Protest, Riots, Class Warfare, Gangs, Life on the Outside, Prologue, Going Legit, Bigotry, Interracial Romance, Voiceover/Narration, Social Justice, Coming of Age, Coming-of-Age Drama",Drama,United States,English,36,2375,3.9
156,The Girl in the Spider’s Web,34983342.0,14828555,20154787,0.4239,"November 9th, 2018",43000000,117,"Delayed Sequel, Sequel With Lead Character Recast, Hackers, Revenge, Weapons of Mass Destruction, Internet, Cyber Warfare, Government Corruption, Action Thriller",Thriller/Suspense,"Sweden, United States",English,"2,929",2929,2.5
157,Mia et le lion blanc,34299855.0,400498,33899357,0.011699999999999999,"April 12th, 2019",0,97,"Coming of Age, Animal Lead, Set in Africa, Nightmare, Soccer, Runaway",Drama,"France, Germany, South Africa","English, French",312,312,1.3
158,The Hurricane Heist,33222314.0,6115824,27106490,0.1841,"March 9th, 2018",40000000,103,"Heist, Extreme Weather, Hackers, Same Role, Multiple Actors, Action Thriller, Prologue, 1990s",Thriller/Suspense,United States,English,"2,402",2402,2.0
159,Nobody’s Fool,32589493.0,31713110,876383,0.9731000000000001,"November 2nd, 2018",19000000,110,"African Americans, Life on the Outside, Dysfunctional Family, Romance, Internet Dating, Catfishing, Comedy Drama, Epilogue, Stolen Identity, Relationships Gone Wrong",Drama,United States,English,"2,468",2468,3.1
160,Baaghi 2,32408855.0,1319579,31089276,0.0407,"March 30th, 2018",0,0,"Kidnap, Rescue, Set in India, Drug Dealer, Organized Crime, Russian Mafia, Jungle, Tortured as Punishment",Action,India,Hindi,123,124,2.4
161,The Strangers: Prey at Night,32144262.0,24431472,7712790,0.7601,"March 9th, 2018",5000000,85,"Home Invasion, Trailer Park, Delayed Sequel, Road Trip, Based on an UNTRUE Story, Slasher Horror, Young Child Dealing with the Death of a Parent, Orphan",Horror,United States,English,"2,464",2464,3.0
162,Super Troopers 2,31966740.0,30617396,1349344,0.9578,"April 20th, 2018",13500000,99,"Directing Yourself, Screenplay Written By the Star, Delayed Sequel, Crowdfunding, Set in Canada, RCMP / Mounties, Police life, Corrupt Cops, Ensemble, Undercover, Smuggler, Farcical / Slapstick Comedy, Scene in End Credits, Kidnap, Rescue",Comedy,United States,English,"2,038",2125,4.1
163,Der Junge muss an die frische Luft,31920181.0,0,31920181,,,0,100,,Comedy,Germany,German,nan,0,
164,Bad Times at the El Royale,31178942.0,17839115,13339827,0.5722,"October 12th, 2018",32000000,141,"One Night, Redemption, Addiction, Narcotics, Heist, False Identity, Motel, 1960s, Set in California, Set in Nevada, Ensemble, Film Noir, Crime Thriller, Cults, Prologue, Intertitle, Surprise Twist, One Location, Faulty Memory, Singers, Non-Chronological",Thriller/Suspense,United States,English,"2,808",2808,2.9
165,Gintama 2: Okite wa Yaburu tame ni koso Aru,30798089.0,0,30798089,,,0,134,,Action,Japan,Japanese,nan,0,
166,Hichki,30444106.0,0,30444106,,"March 23rd, 2018",0,106,"Tourette Syndrome, Teachers, Remake, Foreign-Language Remake, Inspirational Teacher",Drama,India,Hindi,nan,0,
167,Mirai no Mirai,30430147.0,812794,29617353,0.026699999999999998,"November 29th, 2018",0,98,"Anime, Set in Japan, Dysfunctional Family, Time Travel, Spoiled Child, Sibling Rivalry",Adventure,Japan,Japanese,20,780,0.1
168,Meng Chong Guo Jiang,30355804.0,0,30355804,,,0,100,,Adventure,China,Mandarin,nan,0,
169,Kler,29913342.0,0,29913342,,,0,133,,Drama,Poland,"Czech, Italian, Polish",nan,0,
170,Amsusalin,29433930.0,0,29433930,,,0,110,,Drama,Republic of Korea,,nan,0,
171,Lyod,29409365.0,0,29409365,,,0,0,,Multiple Genres,Russian Federation,Russian,nan,0,
172,Hunter Killer,29312121.0,15767460,13544661,0.5379,"October 26th, 2018",40000000,121,"Submarine, Navy Seals, Set in Russia, Betrayal, Kidnap, Political, Rescue, Military Coup, Posthumous Release, Action Thriller",Thriller/Suspense,United States,English,"2,720",2720,2.5
173,Stan & Ollie,29062674.0,5470235,23592439,0.1882,"December 28th, 2018",10000000,98,"Biography, 1950s, On Tour, Set in United Kingdom, Theater, Vaudeville",Drama,"United Kingdom, United States",English,5,754,3.7
174,Padman,28906686.0,1662927,27243759,0.0575,"February 9th, 2018",0,140,"Biography, Set in India, Inspired by a True Story, Relationships Gone Wrong, Life in a Small Town, Poverty",Comedy,India,Hindi,152,152,2.8
175,Free Solo,28605995.0,17541090,11064905,0.6132,"September 28th, 2018",0,100,"Extreme Sports, Mountain Climbing, Set in California, IMAX: DMR",Documentary,United States,English,4,533,8.5
176,Thugs of Hindostan,27942770.0,1449848,26492922,0.0519,"November 8th, 2018",0,164,IMAX: DMR,Action,India,Hindi,377,377,1.0
177,Gukgabudoui Nal,27519661.0,0,27519661,,,0,114,,Drama,Republic of Korea,Korean,nan,0,
178,Boku no Hero Academia the Movie,27507549.0,5427591,22079958,0.1973,"September 25th, 2018",0,96,"Anime, Scene in End Credits, Surprise Twist, Inventor, Hostage, Terrorism, Super Villains",Adventure,Japan,Japanese,508,515,1.0
179,The Happytime Murders,27506412.0,20706452,6799960,0.7528,"August 24th, 2018",40000000,91,"Puppets in a Live-Action World, Private Investigator, Serial Killer, Police Detective, Murder Mystery, Framed, Fugitive / On the Run, Buddy Cop, Death of a Sibling, TV Industry, Discrimination, Film Noir, Surprise Twist, Outtakes During Credits, Scene in End Credits",Black Comedy,United States,English,"3,256",3256,2.7
180,Politseyskiy s Rublyovki. Novogodniy bespredel,27061365.0,0,27061365,,,0,90,,Comedy,Russian Federation,Russian,nan,0,
181,Midnight Sun,26952508.0,9561064,17391444,0.3547,"March 23rd, 2018",2800000,91,"Foreign-Language Remake, Romance, Musicians, Secret Admirer, High School Sports, Coming of Age, Medical and Hospitals, Romantic Drama",Drama,United States,English,"2,173",2173,2.6
182,Zu Zong Shi Jiu Dai,26796280.0,0,26796280,,,0,90,,Comedy,China,Mandarin,nan,0,
183,Kamera o tomeru na!,26702031.0,52406,26649625,0.002,"September 13th, 2019",0,96,,Horror,Japan,Japanese,2,7,2.1
184,"Paul, Apostle of Christ",26078500.0,17547999,8530501,0.6729,"March 23rd, 2018",5000000,113,"Faith-Based Film, Religious, Christians, Discrimination, Prison, Political Prisoner, Ancient Rome, Hagiography, Faith-Based Drama",Drama,United States,English,"1,473",1746,3.2
185,Kensatsu gawa no zainin,26033246.0,0,26033246,,,0,123,,Drama,Japan,Japanese,nan,0,
