Rank,Movie,Worldwide Box Office,Domestic Box Office,International Box Office,"Domestic
Share",Date,Production Budget,Running Time,Keywords,Genre,Production Countries,Languages,Opening_theaters,Max_theaters,Average_run(week)
36,Blade Runner 2049,258023203.0,92054159,165969044,0.3568,"October 6th, 2017",185000000,164,"Delayed Sequel, Robot, Post Apocalypse, Police Procedural, Film Noir, 3-D, 3-D - Post-production Conversion, IMAX: DMR",Thriller/Suspense,United States,English,"4,058",4058,4.6
37,Gong fu yu jia,256004127.0,362657,255641470,0.0014000000000000002,"January 27th, 2017",0,107,"Archaeology, College Professor, Treasure Hunters, Set in India, Set in Tibet, Set in Dubai",Action,"China, India","English, Hindi, Mandarin",14,27,2.3
38,Get Out,252297405.0,175837935,76459470,0.6969,"February 24th, 2017",5000000,104,"Psychological Horror, Interracial Romance, African Americans, Suburbs, Actors Making Their Directorial Debut, Missing Person, Prologue, Magical Technology, Unbelieving Police, Photography, Relationships Gone Wrong, Young Child Dealing with the Death of a Parent, Hit and Run, Hypnotism, Therapists / Therapy, Abusive Therapists, 2018 Oscars Best Picture Nominee",Horror,United States,English,"2,781",3143,7.7
39,Xi You Fu Yao Pian,248805149.0,880346,247924803,0.0034999999999999996,"February 3rd, 2017",0,108,"Set in India, Visual Effects, Demons, Possessed, Ancient China, Chinese Mythology, Dream Sequence",Action,China,Mandarin,67,67,2.3
40,Alien: Covenant,238521247.0,74262031,164259216,0.31129999999999997,"May 19th, 2017",97000000,123,"Alien Encounters, Set in Outer Space, Robot, Archaeology, Trapped, Inbetwequel, Same Actor, Multiple Roles, Humans as Aliens, Space Colonization, 3-D, Monster, IMAX: DMR, Survival Horror",Horror,United States,English,"3,761",3772,3.6
41,Fang Hua,227089269.0,1891956,225197313,0.0083,"December 15th, 2017",0,136,"1970s, Set in China, Coming of Age, Unrequited Love, War, 1990s, Epilogue",Drama,China,Mandarin,30,35,4.0
42,Baby Driver,226977991.0,107825862,119152129,0.475,"June 28th, 2017",34000000,115,"Heist, Organized Crime, Getaway Driver, One Last Job, No Honor Among Thieves, Car Chase, Romance",Thriller/Suspense,"United Kingdom, United States",English,"3,226",3226,6.7
43,Geostorm,220796009.0,33700160,187095849,0.15259999999999999,"October 20th, 2017",100000000,109,"Extreme Weather, Set in Outer Space, Space Program, Assassination, Political Assassination, Delayed Release, Development Hell, Near Future, 3-D, 3-D - Post-production Conversion, IMAX: DMR, Techno-Thriller",Thriller/Suspense,United States,English,"3,246",3246,3.8
44,The Emoji Movie,216564839.0,86089513,130475326,0.3975,"July 28th, 2017",50000000,86,"Social Media, Internet, Family Movie, 3-D, 3-D - Shot in 3-D",Adventure,United States,English,"4,075",4075,5.8
45,Valerian and the City of a Thousand Planets,215098356.0,40479370,174618986,0.1882,"July 21st, 2017",180000000,129,"Set in Outer Space, Space Opera, Romance, Alien Encounters, Robot, Unrequited Love, Motion Capture Performance, 3-D, 3-D - Post-production Conversion, IMAX: DMR",Adventure,France,English,"3,553",3553,3.1
46,A Dog’s Purpose,203055427.0,64321890,138733537,0.31679999999999997,"January 27th, 2017",25000000,100,"Animal Lead, Talking Animals, Death of a Pet, Reincarnation, Relationships Gone Wrong, Exes in Love, Romance, Police life, Coming of Age, Voiceover/Narration, 1960s, 1980s, 2010s, 1990s, 1970s, Same Role, Multiple Actors, Family Movie, Family Drama",Drama,United States,English,"3,059",3178,5.7
47,Smurfs: The Lost Village,197578586.0,45020282,152558304,0.2279,"April 7th, 2017",60000000,90,"Reboot, 3-D, 3-D - Shot in 3-D, Road Trip, Animal Lead, Voiceover/Narration, Prologue, Non-Chronological, Underground, Rescue, Family Movie, Directing Yourself, Scene in End Credits",Adventure,United States,English,"3,610",3610,5.0
48,The Shape of Water,195790794.0,63859435,131931359,0.3262,"December 1st, 2017",19500000,123,"Romance, 1960s, Cold War, Space Program, Escape, Creature Feature, Interspecies Romance, Retro Black and White, Dream Sequence, Voiceover/Narration, Oscars Best Picture Winner, 2018 Oscars Best Picture Nominee, Supernatural, Romantic Drama",Drama,United States,English,2,2341,6.6
49,Paddington 2,192744317.0,40891591,151852726,0.2122,"January 12th, 2018",0,103,"Animal Lead, Talking Animals, Wrongfully Convicted, Falsely Accused, Prison, Treasure Hunters, Prison Break, Coma, Motion Capture Performance, IMAX: DMR",Adventure,"France, United Kingdom",English,"3,702",3702,4.1
50,Pitch Perfect 3,185736412.0,104897530,80838882,0.5648,"December 22nd, 2017",45000000,93,"Musicians, Singers, Romance, Tournament, Ensemble",Comedy,United States,English,"3,447",3468,5.0
51,The Hitman’s Bodyguard,183415183.0,75468583,107946600,0.4115,"August 18th, 2017",30000000,111,"Bodyguard, Hitmen, Car Chase, Special Ops, Witness Protection, Interpol, Corrupt Cops, Intertitle, Prologue, Epilogue, Outtakes During Credits, Romance, Bonnie and Clyde romance, Set in England, Set in Netherlands, Set in Amsterdam, Set in The Hague, On a Boat, Action Comedy",Action,United States,English,"3,377",3377,6.1
52,The Post,179769457.0,81903458,97865999,0.4556,"December 22nd, 2017",50000000,115,"Newspaper Industry, Political, Government Corruption, Cover Up, Vietnam War, News, Investigative Journalist, 2018 Oscars Best Picture Nominee, Docudrama",Drama,United States,English,9,2851,5.6
53,Baywatch,175863783.0,58060186,117803597,0.3301,"May 25th, 2017",60000000,119,"Lifeguard, Set in California, Professional Rivalry, Organized Crime, Amatuer Slueth, Adapted as a Comedy, Action Comedy",Comedy,United States,English,"3,647",3647,3.5
54,Daddy’s Home 2,175807183.0,104029443,71777740,0.5917,"November 10th, 2017",70000000,100,"Step-Family, Dysfunctional Family, Christmas, Christmas in November",Comedy,United States,English,"3,575",3575,6.5
55,John Wick: Chapter Two,171139626.0,92029184,79110442,0.5377000000000001,"February 10th, 2017",40000000,122,"Hitmen, Set in Rome, Italy, Organized Crime, Gang Warfare, Out of Retirement",Action,United States,English,"3,113",3113,5.1
56,Ghost in the Shell,167910690.0,40563557,127347133,0.2416,"March 31st, 2017",110000000,100,"Live Action Cartoon, Robot, Cyborg, Dystopia, Implanted Memory, Organized Crime, 3-D, 3-D - Post-production Conversion, IMAX: DMR",Action,United States,English,"3,440",3440,3.2
57,"Three Billboards Outside Ebbing, Missouri",161158351.0,54513740,106644611,0.3383,"November 10th, 2017",12000000,115,"Police Brutality, Police Procedural, Corrupt Cops, Murder Mystery, Sex Crimes, Bigotry, Death of a Son or Daughter, Death of a Sibling, Dysfunctional Family, Terminal Illness, Cancer, Suicide, Non-Chronological, 2018 Oscars Best Picture Nominee, Golden Globe Winner Best Picture—Drama, Black Comedy",Black Comedy,United States,English,4,1726,8.9
58,Cheng feng po lang,153018738.0,469706,152549032,0.0031,"February 10th, 2017",0,102,"Set in China, Car Accident, Near Death Experience, Time Travel, Dysfunctional Family, Life in a Small Town, Auto Racing",Drama,China,Mandarin,27,30,2.8
59,Darkest Hour,150807630.0,56443120,94364510,0.3743,"November 22nd, 2017",30000000,125,"World War II, 1940s, Politicians, Nazis, Biography, Political, Royalty, Set in London, Set in England, Archive Footage, 2018 Oscars Best Picture Nominee, War Drama",Drama,United Kingdom,English,4,1733,7.7
60,The Foreigner,145374099.0,34393507,110980592,0.2366,"October 13th, 2017",35000000,116,"Terrorism, Death of a Son or Daughter, Revenge, Set in Ireland, Politicians, The Past Catching up with You, 3-D, 3-D - Post-production Conversion, IMAX: DMR, Action Thriller",Action,"China, United Kingdom",English,"2,515",2515,4.1
61,Power Rangers,142531552.0,85364450,57167102,0.5989,"March 24th, 2017",120000000,124,"Reboot, Mecha, Alien Encounters, Bullies, House Arrest, Car Accident, Robot, Prank Gone Wrong, Football, High School Sports, Intertitle, Training Montage, Betrayal, Slow Motion Scene, Origin Story, Medical and Hospitals, LGBTQ+, Young Child Dealing with the Death of a Parent",Action,United States,English,"3,693",3693,4.3
62,Girls Trip,140886353.0,115108515,25777838,0.8170000000000001,"July 21st, 2017",28000000,122,"Music Festival, Set in New Orleans, LA, Set in Louisiana, African Americans, Road Trip, Girls' Night Out",Comedy,United States,English,"2,591",2648,6.8
63,King Arthur: Legend of the Sword,139630336.0,39175066,100455270,0.28059999999999996,"May 12th, 2017",175000000,126,"Royalty, Prophecy, Orphan, Sword & Sorcerer, Footage Shown in Reverse, Young Child Dealing with the Death of a Parent, Revenge, Middle Ages, 3-D, 3-D - Post-production Conversion",Adventure,"Australia, United States",English,"3,702",3702,3.3
64,American Made,135569212.0,51342000,84227212,0.3787,"September 29th, 2017",50000000,114,"C.I.A., 1980s, Drug Trafficking, Narcotics, Smuggler, Crime Caper, In a Plane, IMAX: DMR, Action Comedy",Action,United States,English,"3,024",3098,4.8
65,Secret Superstar,128719011.0,0,128719011,,"October 19th, 2017",0,149,"Set in India, Coming of Age, Singers, Dysfunctional Family, Reality TV, Big Break, Musicians, Internet, Viral Video, Orthodox Religion",Musical,India,Hindi,nan,0,
66,A Bad Moms Christmas,127710550.0,72110659,55599891,0.5646,"November 1st, 2017",28000000,104,"Christmas, Dysfunctional Family, Generational Conflict, Christmas in November, Prologue, Non-Chronological, Voiceover/Narration, Death of a Spouse or Fiancée / Fiancé, Widow/Widower, Strippers / Stripping, Money Troubles, Gambling, Intertitle, Buddy Comedy",Comedy,United States,English,"3,615",3615,5.1
67,Captain Underpants: The First Epic Movie,126422949.0,73921000,52501949,0.5847,"June 2nd, 2017",38000000,89,"Elementary School, Hypnotism, Super Villains, Secret Identity, Bad Teachers, Prank Gone Wrong, Set in Ohio, Robot, Unrequited Love, 3-D, 3-D - Shot in 3-D",Adventure,United States,English,"3,434",3529,4.6
68,Happy Death Day,125010260.0,55683845,69326415,0.4454,"October 13th, 2017",5000000,96,"College, Murder Mystery, Time Travel, One Day, Development Hell, Horror Comedy, Alternate or Altered Realities",Horror,United States,English,"3,149",3535,4.1
69,The Lego Ninjago Movie,122737201.0,59281555,63455646,0.483,"September 22nd, 2017",70000000,101,"Ninja, Martial Arts, High School, Monster, Super Villains, Secret Identity, Dysfunctional Family, 3-D, 3-D - Shot in 3-D",Adventure,"Denmark, United States",English,"4,047",4047,5.1
70,The Dark Tower,113461527.0,50701325,62760202,0.44689999999999996,"August 4th, 2017",66000000,95,"Cowboys in Modern Times, Post Apocalypse, Alternative Dimensions / Parallel universe, Supernatural, Good vs. Evil, Development Hell",Western,United States,English,"3,451",3451,5.0
71,Buddies in India,110203801.0,292662,109911139,0.0027,"January 27th, 2017",0,99,"Set in India, Inheritance, Secret or Hidden Will, Directing Yourself, Screenplay Written By the Star",Action,China,Mandarin,55,55,1.5
72,Along With The Gods: The Two Worlds,107476731.0,1908822,105567909,0.0178,"December 22nd, 2017",0,140,"Firefighter, Reincarnation, Afterlife, Underworld",Action,Republic of Korea,Korean,17,35,4.5
73,Jigsaw,104223315.0,38052832,66170483,0.3651,"October 27th, 2017",10000000,91,"Family Affair, Torture Porn, Kidnap, Escape, Posthumous Adventure, Murder Mystery, Serial Killer, Delayed Sequel, IMAX: DMR, Slasher Horror",Horror,United States,English,"2,941",2941,3.7
74,Wukong,103651195.0,0,103651195,,,0,130,,Action,China,Mandarin,nan,0,
75,Life,101815660.0,30234022,71581638,0.2969,"March 24th, 2017",58000000,103,"Set in Outer Space, Set in Space Station, Alien Encounters, Trapped, One Location, Isolation Horror, IMAX: DMR",Thriller/Suspense,"United Kingdom, United States",English,"3,146",3146,3.3
76,Atomic Blonde,98345423.0,51573925,46771498,0.5244,"July 28th, 2017",30000000,114,"Undercover, Cold War, Set in Berlin, Double Agent, Secret Agent, 1980s, Commies, Independent/Other Comics, IMAX: DMR, Action Thriller",Thriller/Suspense,United States,English,"3,304",3326,3.9
77,Yao Mao Zhuan,97033612.0,0,97033612,,,0,119,,Drama,"China, Hong Kong, Japan","Japanese, Mandarin",nan,0,
78,The Shack,96860808.0,57386418,39474390,0.5925,"March 3rd, 2017",20000000,132,"Death of a Son or Daughter, Supernatural, Faith-Based Film, Dysfunctional Family, Domestic Abuse, Death of a Sibling, Faith-Based Drama",Drama,United States,English,"2,888",2888,5.4
79,Chasing the Dragon,87969037.0,456854,87512183,0.0052,"September 29th, 2017",0,128,"Set in China, Hong Kong, Immigration, Narcotics, Organized Crime, 1960s, 1970s, Corrupt Cops, Impersonating a Police Officer",Action,"China, Hong Kong","Cantonese, Teochew",52,52,2.1
80,Taeksi Woonjunsa,87069724.0,1527829,85541895,0.0175,"August 11th, 2017",0,137,"1980s, Seoul, Widow/Widower, Taxi Driver, Investigative Journalist, Political Protest, Set in South Korea",Drama,Republic of Korea,Korean,41,41,5.0
81,Rings,82917283.0,27793018,55124265,0.33520000000000005,"February 3rd, 2017",25000000,102,"Supernatural, Curses, Delayed Sequel, Development Hell, Delayed Release, Supernatural Horror",Horror,United States,English,"2,931",2931,2.9
82,Once Upon a Time,82891949.0,485728,82406221,0.0059,"August 11th, 2017",0,108,"Suicide, Set in China, Non-Chronological, Romance, Dragon, Gods and Goddesses, War, Demons, Faulty Memory, 3-D, 3-D - Post-production Conversion, IMAX: DMR",Drama,China,Mandarin,51,51,2.2
83,Going in Style,80812424.0,45018541,35793883,0.5571,"April 7th, 2017",24000000,96,"Remake, Heist, Money Troubles, White Collar Crime, Revenge, Autumn Years, Retirement, Crime Comedy, Crime Caper",Comedy,United States,English,"3,061",3076,5.6
84,Lady Bird,80120944.0,48958273,31162671,0.6111,"November 3rd, 2017",10000000,93,"Set in California, 2000s, Dysfunctional Family, Coming of Age, LGBTQ+, Loss Of Virginity, 9/11, 2018 Oscars Best Picture Nominee, Comedy Drama, Golden Globe Winner Best Picture—Musical or Comedy",Drama,United States,English,4,1557,8.0
85,Sha Po Lang: Tan Lang,79226860.0,0,79226860,,,14500000,101,,Action,"China, Hong Kong",Cantonese,nan,0,
86,Boonie Bears: Entangled Worlds,77072065.0,0,77072065,,"June 14th, 2019",0,91,"Talking Animals, Animal Lead, Family Movie, Good vs. Evil, Enemies Forced to Work Together, Robot, Treasure Hunters",Adventure,China,English,nan,0,
87,Tiger Zinda Hai,76520376.0,5560921,70959455,0.0727,"December 22nd, 2017",0,145,"Inspired by a True Story, Set in Iraq, Hostage, Rescue, 2010s",Action,India,Hindi,299,299,2.5
88,Feng Ren Ji Yue Dui,68722321.0,312537,68409784,0.0045000000000000005,"October 6th, 2017",0,140,"Directing Yourself, Rock 'n' Roll, Set in China, Life in a Small Town, Real Estate Agent",Musical,China,Mandarin,43,43,1.9
89,American Assassin,68310140.0,36249674,32060466,0.5307,"September 15th, 2017",63000000,112,"Secret Agent, Revenge, C.I.A., World War III, Set in Middle East, Terrorism, Action Thriller",Thriller/Suspense,United States,English,"3,154",3154,3.9
90,Victoria and Abdul,68271146.0,22245070,46026076,0.3258,"September 22nd, 2017",21000000,112,"Royalty, Prince/Princess, Biography, Victorian Age, Set in India, Set in England, British Empire, 1880s, Culture Clash, Biographical Drama",Drama,"United Kingdom, United States",English,4,1060,5.7
91,Fack ju Göhte 3,65994485.0,0,65994485,,,0,118,,Comedy,Germany,German,nan,0,
92,Meitantei Konan: Kara Kurenai no Rabu Retta,64724172.0,0,64724172,,,0,112,,Action,Japan,Japanese,nan,0,
93,The Star,62634998.0,40847995,21787003,0.6522,"November 17th, 2017",20000000,86,"Faith-Based Film, Animal Lead, Talking Animals, Christmas, Christmas in November, Religious",Adventure,United States,English,"2,837",2976,5.4
94,47 Meters Down,62633705.0,44307193,18326512,0.7073999999999999,"June 16th, 2017",5300000,89,"Death of a Sibling, Hallucinations, Surprise Twist, Vacation, Set in Mexico, Underwater, Trapped, Animal Lead, Tourists In Trouble, Animals Gone Bad, Survival Thriller",Thriller/Suspense,United States,English,"2,270",2471,5.0
95,The Mountain Between Us,62617547.0,30348555,32268992,0.48469999999999996,"October 6th, 2017",0,104,"Accidental Death, Survivalist, Trapped, Mountain Climbing, Extreme Weather, Survival Adventure, In a Plane, Plane Crash, Animals Gone Bad, Marooned, Romance, Relationships Gone Wrong, Widow/Widower",Adventure,United States,English,"3,088",3259,4.2
96,How to Be a Latin Lover,62556228.0,32149404,30406824,0.5139,"April 28th, 2017",10000000,115,"Dysfunctional Family, Bad Role Models, Faked Romance, Relationships Gone Wrong, May / December Romance, Actors Making Their Directorial Debut, Hispanic, Family Comedy",Comedy,United States,"English, Spanish","1,118",1203,4.6
97,Dvizhenie Vverkh,61925449.0,0,61925449,,,7800000,133,,Drama,Russian Federation,Russian,nan,0,
98,"Everything, Everything",61603136.0,34121140,27481996,0.5539000000000001,"May 19th, 2017",10000000,96,"Medical and Hospitals, Romance, Coming of Age, Shut In, Young Adult Book Adaptation, Romantic Drama, Mental Illness, Death of a Spouse or Fiancée / Fiancé, Death of a Son or Daughter, Death of a Sibling, Young Child Dealing with the Death of a Parent, Surprise Twist",Drama,United States,English,"2,801",2801,3.8
99,Eiga Doraemon: Nobita no nankyoku kachikochi da…,61403776.0,0,61403776,,,0,101,Anime,Adventure,Japan,Japanese,nan,0,
100,My Little Pony: The Movie,61294644.0,21885107,39409537,0.35700000000000004,"October 6th, 2017",6500000,99,"Animal Lead, Talking Animals, Dragon, Monster, Military Coup, Pirates, Mermaids",Adventure,"Canada, United States",English,"2,528",2528,4.4
101,The Founding of an Army,60600360.0,0,60600360,,,0,133,IMAX: DMR,Action,"China, Hong Kong",Mandarin,nan,0,
102,Snatched,60129558.0,45852178,14277380,0.7626000000000001,"May 12th, 2017",42000000,90,"Dysfunctional Family, Relationships Gone Wrong, Vacation, Tourists In Trouble, Screenplay Written By the Star, Farcical / Slapstick Comedy, Revenge, Kidnap, Ransom, Accidental Death, Killing in Self Defence, Fugitive / On the Run",Comedy,United States,English,"3,501",3511,3.6
103,The Devotion of Suspect X,59263153.0,686435,58576718,0.0116,"March 31st, 2017",0,112,"Domestic Abuse, Stalker, Relationships Gone Wrong, Accidental Death, Covering Up an Accidental Death, Mathematics, Police Procedural, Set in China, Unrequited Love",Thriller/Suspense,China,Mandarin,43,46,2.6
104,Chāi dàn zhuānjiā,58807172.0,0,58807172,,"May 5th, 2017",23000000,119,"Organized Crime, Undercover, Revenge, Hong Kong, Hostage, Heist, Police Shooting, Buried Alive",Action,Hong Kong,Cantonese,nan,0,
105,Yao Ling Ling,57628372.0,186135,57442237,0.0032,"January 5th, 2018",0,89,"Internet, Gangs, Land Developer, Supernatural, Haunting, Paranormal Investigation, Exorcism",Comedy,China,Mandarin,24,24,1.6
106,The Nut Job 2: Nutty by Nature,57424952.0,28370522,29054430,0.494,"August 11th, 2017",40000000,91,"Animal Lead, Talking Animals, Food, Land Developer, Amusement Park, Government Corruption, Mayor, 3-D, 3-D - Shot in 3-D",Adventure,"Canada, Republic of Korea, United States",English,"4,003",4003,4.0
107,All the Money in the World,56890649.0,25106325,31784324,0.4413,"December 25th, 2017",50000000,132,"Kidnap, Ransom, Dysfunctional Family, 1970s, Voiceover/Narration, Non-Chronological, True Crime, Biographical Drama, Crime",Thriller/Suspense,"United Kingdom, United States",English,"2,074",2123,3.1
108,The Big Sick,56868677.0,42872467,13996210,0.7539,"June 23rd, 2017",5000000,119,"Arranged Marriage, Relationships Gone Wrong, Set in Chicago, College, Romance, One Night Stand, Medical and Hospitals, Interracial Romance, Dysfunctional Family, Muslims, Screenplay Written By the Star, Family Affair, Intertitle, Scene in End Credits, Culture Clash, About a Stand Up Comedian",Romantic Comedy,United States,"English, Urdu",5,2597,4.9
109,Confidential Assignment,56450663.0,475618,55975045,0.0084,"February 3rd, 2017",0,125,"Set in North Korea, Set in South Korea, Buddy Cop, Organized Crime, Forgery, White Collar Crime, Crime Thriller, Corrupt Cops, Death of a Spouse or Fiancée / Fiancé",Action,Republic of Korea,Korean,nan,0,
110,Downsizing,54462971.0,24449754,30013217,0.4489,"December 22nd, 2017",68000000,135,"Tiny Worlds, Human Experimentation, Therapists / Therapy, Therapist, Relationships Gone Wrong, Gratuitous Cameos, Satire, Satirical Comedy",Comedy,United States,English,"2,668",2668,3.0
111,"I, Tonya",53797409.0,30014534,23782875,0.5579,"December 8th, 2017",11000000,120,"Winter Sports, Figure Skating, Olympics, 1990s, Media Circus, Biography, Dysfunctional Family, Intertitle, Based on an UNTRUE Story, Non-Chronological, Breaking the Fourth Wall, Set in Portland, Oregon, Voiceover/Narration, Child Abuse, Child Prodigy, First Love, Romance, Relationships Gone Wrong, Domestic Abuse, Underdog, Poverty, Comeback, 1970s, 1980s, High School Dropout, Epilogue, Scene in End Credits",Black Comedy,United States,English,4,1450,5.0
112,Molly’s Game,53296424.0,28780744,24515680,0.54,"December 25th, 2017",30000000,140,"Skiing, Olympics, FBI, Russian Mafia, Gambling, Courtroom Drama, Voiceover/Narration, Intertitle, Sports Injury, Non-Chronological, Dysfunctional Family, Infidelity, Biography, Autobiographical",Drama,United States,English,271,1708,4.1
113,Bareilly Ki Barfi,52117236.0,0,52117236,,,0,116,,Musical,India,Hindi,nan,0,
114,The Outlaws,52097753.0,0,52097753,,,0,121,,Action,Republic of Korea,Korean,nan,0,
115,1987: When the Day Comes,51775357.0,0,51775357,,,0,129,,Drama,Republic of Korea,Korean,nan,0,
116,Logan Lucky,49046121.0,27778642,21267479,0.5664,"August 18th, 2017",29000000,119,"Curses, Auto Racing, Heist, Set in North Carolina, Dysfunctional Family, Ensemble, Gratuitous Cameos, NASCAR, Crime Caper, Crime Comedy",Comedy,United States,English,"3,031",3031,4.4
117,Kōng tiān liè,48069252.0,0,48069252,,,0,118,,Action,China,Mandarin,nan,0,
118,Tyler Perry’s Boo 2! A Madea Halloween,47879572.0,47319572,560000,0.9883,"October 20th, 2017",20000000,100,"Halloween, Directing Yourself, Screenplay Written By the Star, Supernatural, Camping, Spoof, Same Actor, Multiple Roles, Horror Comedy",Comedy,United States,English,"2,388",2388,4.3
119,Ji Qi Zhi Xue,47872755.0,0,47872755,,"July 6th, 2018",0,110,"Martial Arts, Secret Agent, Gangs, Research Scientist, The Past Catching up with You, Early / Simultaneous Video-on-Demand release, Dwarfism",Action,"China, Hong Kong","English, Mandarin",nan,0,
120,Phantom Thread,47740743.0,21198205,26542538,0.444,"December 25th, 2017",35000000,130,"1950s, Fashion, Relationships Gone Wrong, Medical and Hospitals, Cross-Class Romance, May / December Romance, Domestic Abuse, Non-Chronological, Set in London, Set in England, 2018 Oscars Best Picture Nominee, Historical Drama",Drama,United States,English,4,1186,4.9
121,Rough Night,46844357.0,22105643,24738714,0.4719,"June 16th, 2017",20000000,101,"Strippers / Stripping, Parties Gone Wild, College, Bachelor Party, Friends Reuniting, Accidental Death, Covering Up an Accidental Death, Screenplay Written By the Star, Ensemble",Black Comedy,United States,English,"3,162",3162,2.8
122,Qi Man Dun Jia,46263233.0,124187,46139046,0.0027,"December 15th, 2017",0,113,"Supernatural, Wuxia, Martial Arts, Ancient China, Chinese Mythology",Action,"China, Hong Kong",Cantonese,27,27,1.2
123,Er Dai Yao Jing,46154324.0,0,46154324,,"January 5th, 2018",0,90,"Demons, Romance, Forbidden Romance, Chinese Mythology, Supernatural",Romantic Comedy,China,Mandarin,nan,0,
124,Gunhamdo,45872441.0,1104957,44767484,0.0241,"August 4th, 2017",0,132,"Prison Break, Cruel Wardens or Prison Guards, 1930s, Set in Korea, Set in Japan, Escape",Drama,Republic of Korea,Korean,nan,0,
125,Gintama,45776563.0,0,45776563,,"January 19th, 2018",0,130,"Anime, Live Action Cartoon, Alien Invasion, Feudal Japan, Samurai",Action,Japan,Japanese,nan,0,
126,Xin Li Zui,45698504.0,0,45698504,,,0,110,,Action,China,Mandarin,nan,0,
127,The Circle,45497689.0,20497844,24999845,0.45049999999999996,"April 28th, 2017",18000000,110,"Internet, Corporate Life, Big Brother, Dystopia, Shadowy Organization, Corporate Malfeasance, Novel or Other Work Adapted by Author, Posthumous Release, Techno-Thriller",Thriller/Suspense,United States,English,"3,163",3163,3.0
128,Flatliners,45173738.0,16883115,28290623,0.3737,"September 29th, 2017",20000000,110,"Death of Other Extended Family, Supernatural, Medical Students, Near Death Experience, Delayed Sequel, Human Experimentation, Psychological Horror, Reboot",Horror,United States,English,"2,552",2552,3.2
129,Wind River,44984979.0,33800859,11184120,0.7514,"August 4th, 2017",11000000,107,"Native Americans, Murder Mystery, FBI, Revenge, Set in Wyoming, Sex Crimes, Bigotry, Vigilante, Death of a Son or Daughter, Intertitle, Epilogue, Inspired by a True Story, Voiceover/Narration, Non-Chronological, Cabin Fever, 2010s, The Past Catching up with You, Interracial Romance, Crime drama",Thriller/Suspense,United States,English,4,2890,4.9
130,mother!,44516999.0,17800004,26716995,0.3998,"September 15th, 2017",30000000,108,"Dysfunctional Family, Film Actor, Psychological Thriller",Thriller/Suspense,United States,English,"2,368",2368,3.1
131,Loving Vincent,44071758.0,6735118,37336640,0.1528,"September 22nd, 2017",5500000,95,"Mental Hospital, Crowdfunding, Artists, Mental Illness, Suicide, Non-Chronological, Biography, Epilogue, 1890s, Motion Capture Performance, Biographical Drama",Drama,United Kingdom,English,1,218,8.2
132,Namiya Zakkaten no Kiseki,44009570.0,0,44009570,,,0,129,,Drama,Japan,Japanese,nan,0,
133,Jìyì dàshī,43888531.0,587470,43301061,0.0134,"April 28th, 2017",20000000,119,"Writing and Writers, Messy Divorce, Faulty Memory, Magical Technology, Serial Killer, Relationships Gone Wrong, 2020s, Near Future",Thriller/Suspense,China,Mandarin,42,42,2.8
